{
  "$schema": "./apps.schema.json",
  "description": "MIF org GitHub-App auth manifest — single source of truth. Six least-privilege GitHub Apps mint short-lived installation tokens for org workflows. Each App is identified by its OAuth client-id (GitHub's current best practice; the legacy numeric app-id is deprecated and warns). Per app: id_variable = org Actions VARIABLE holding the OAuth client-id (Iv23...; public, so optional-App jobs may gate on it in if:); key_secret = org Actions SECRET holding the App private key (PEM); permissions = installed least-privilege set (Repository perms unless prefixed org:; metadata:read implicit); install_on = repos the App is installed on ('all' = every org repo, org-wide; the apps are installed org-wide and wired per gate as repos adopt the standard suite); consumers = workflows that mint this App's token. Tokens are minted with the SHA-pinned mint_action via its client-id input. Governed by ADR-011 (supersedes ADR-008); validated in CI by .github/workflows/app-manifest-validate.yml via inline jq cross-checks (SHA pin, role/name match, credential uniqueness, required fields, permission enums, no unknown keys, install_on, consumer paths). auth/apps.schema.json documents the manifest shape but is not executed in CI.",
  "version": 1,
  "mint_action": "actions/create-github-app-token@bcd2ba49218906704ab6c1aa796996da409d3eb1",
  "identifier": "client-id",
  "apps": {
    "ci": {
      "purpose": "General CI cross-repo identity. Reads org/sibling state the default GITHUB_TOKEN cannot — primary consumer is OpenSSF Scorecard reading branch protection (administration:read) so posture scores from real settings. Also mints the read-only cross-repo identity MIF's deploy uses to fetch and attestation-verify the ontologies repo's signed release tarball (ADR-019).",
      "id_variable": "CI_CLIENT_APP_ID",
      "key_secret": "CI_CLIENT_APP_PRIVATE_KEY",
      "permissions": {
        "contents": "read",
        "administration": "read",
        "pull_requests": "read",
        "issues": "read",
        "actions": "read",
        "checks": "read",
        "attestations": "read"
      },
      "install_on": "all",
      "consumers": [
        ".github/.github/workflows/reusable-scorecard.yml",
        "MIF/.github/workflows/deploy.yml"
      ]
    },
    "catalog": {
      "purpose": "Marketplace catalog updates — re-pins external plugin entries (including a marketplace's own self-referential entries for vendored plugins) to their latest attested release and opens auto-merge PRs against the catalog.",
      "id_variable": "CATALOG_CLIENT_APP_ID",
      "key_secret": "CATALOG_CLIENT_APP_PRIVATE_KEY",
      "permissions": {
        "contents": "write",
        "actions": "write",
        "pull_requests": "write"
      },
      "install_on": "all",
      "consumers": [
        ".github/.github/workflows/plugin-catalog-update-hub.yml",
        "gdlc/.github/workflows/release.yml"
      ]
    },
    "pages": {
      "purpose": "Cross-repo org Pages deploy/notify — docs-source repos build then notify the github.io assembly repo to compose and deploy.",
      "id_variable": "PAGES_CLIENT_APP_ID",
      "key_secret": "PAGES_CLIENT_APP_PRIVATE_KEY",
      "permissions": {
        "contents": "write",
        "pages": "write",
        "actions": "write"
      },
      "install_on": "all",
      "consumers": [
        "modeled-information-format.github.io/.github/workflows/deploy.yml",
        "research-harness-template/.github/workflows/docs.yml",
        "ontologies/.github/workflows/release.yml"
      ]
    },
    "automerge": {
      "purpose": "Dependabot auto-approve and merge. Dependabot cannot approve its own PR; this App supplies the non-Dependabot approval identity.",
      "id_variable": "AUTOMERGE_CLIENT_APP_ID",
      "key_secret": "AUTOMERGE_CLIENT_APP_PRIVATE_KEY",
      "permissions": {
        "contents": "write",
        "pull_requests": "write"
      },
      "install_on": "all",
      "consumers": [
        ".github/.github/workflows/reusable-dependabot-automerge.yml"
      ]
    },
    "release": {
      "purpose": "Authenticates the gh release / contents-write steps in release.yml. The keyless OIDC attestation (id-token + attestations) is unchanged — the attestation signer SAN stays the workflow, so gh attestation verify is unaffected. This App only authenticates the publish/contents steps.",
      "id_variable": "RELEASE_CLIENT_APP_ID",
      "key_secret": "RELEASE_CLIENT_APP_PRIVATE_KEY",
      "permissions": {
        "contents": "write",
        "packages": "write"
      },
      "install_on": "all",
      "consumers": [
        "MIF/.github/workflows/release.yml",
        "ontologies/.github/workflows/release.yml",
        "research-harness-template/.github/workflows/release.yml",
        "mif-docs-plugin/.github/workflows/release.yml",
        "claude-code-plugins/.github/workflows/release.yml"
      ]
    },
    "issues": {
      "purpose": "Issues/sub-issues/Milestones/Discussions/Projects-v2 write identity for the gdlc planning plugins' live integration tests — GITHUB_TOKEN is rejected for org-level Projects v2 mutations, so a real CI run against a sandbox repo needs an App-minted token. Permission set is derived from an endpoint audit of gdlc@8c4fdcb's plugins/*/mcp-server/src (see PR description for the call-by-call trace).",
      "id_variable": "ISSUES_CLIENT_APP_ID",
      "key_secret": "ISSUES_CLIENT_APP_PRIVATE_KEY",
      "permissions": {
        "issues": "write",
        "pull_requests": "write",
        "discussions": "write",
        "org:projects": "write"
      },
      "install_on": "all",
      "consumers": [
        "gdlc/.github/workflows/live-integration-tests.yml"
      ]
    }
  }
}
